{
    "$schema": "https://json-schema.org/draft/2020-12/schema",
    "$id": "https://github.com/jovibor/HexCtrl/blob/master/docs/HexCtrl.Templates.Schema.json",
    "title": "HexCtrl Templates Schema",
    "type": "object",
    "properties": {
        "TemplateName": {
            "type": "string"
        },
        "clrBkDefault": {
            "type": "string",
            "format": "color"
        },
        "clrTextDefault": {
            "type": "string",
            "format": "color"
        },
        "Fields": {
            "$ref": "HexCtrl.Templates.Fields.Schema.json"
        }
    },
    "required": [
        "TemplateName",
        "Fields"
    ]
}